{
  "id": "operational_team_leader",
  "name": "Operational Team Leader",
  "aliases": [],
  "service": "ambulance",
  "qualification_type": "role-qualification",
  "roles": ["Operational Team Leader"],
  "notes": [
    "Official UK missions verify Operational Team Leader as a required or probabilistic personnel role.",
    "Course name, duration and prerequisites remain unverified."
  ],
  "verification": {
    "status": "verified",
    "checked_at": "2026-07-22",
    "sources": [
      "https://www.missionchief.co.uk/einsaetze/143",
      "https://www.missionchief.co.uk/einsaetze/593"
    ]
  }
}
